{
  "title": "Frère Jacques",
  "composer": "Traditional (French round, 18th century)",
  "composer_death_year": null,
  "traditional": true,
  "transcriber": "OpenTiles contributors",
  "arranger": "OpenTiles contributors",
  "source_url": "https://github.com/KunalGehlot/OpenTiles/tree/main/catalogue/pieces/frere-jacques",
  "source_licence": "CC0-1.0",
  "edition_note": "Original simplified arrangement written for OpenTiles from the public-domain melody; not copied from any published edition. Source: arrangement.txt, rendered with tools/pipeline/arrange.py.",
  "eu_term_check": {
    "result": "pass",
    "date": "2026-10-07"
  },
  "difficulty": 1,
  "reviewed_by": "KunalGehlot",
  "verified": true,
  "reviewed_on": "2026-10-09",
  "score_file": "score.musicxml"
}
