{
  "title": "In the Hall of the Mountain King (opening)",
  "composer": "Edvard Grieg",
  "composer_death_year": 1907,
  "traditional": false,
  "transcriber": "OpenTiles contributors",
  "arranger": "OpenTiles contributors",
  "source_url": "https://github.com/KunalGehlot/OpenTiles/tree/main/catalogue/pieces/hall-of-the-mountain-king",
  "source_licence": "CC0-1.0",
  "edition_note": "Original simplified arrangement written for OpenTiles from the public-domain melody; not copied from any published edition. Source: arrangement.txt, rendered with tools/pipeline/arrange.py.",
  "eu_term_check": {
    "result": "pass",
    "date": "2026-10-07"
  },
  "difficulty": 3,
  "reviewed_by": null,
  "verified": false,
  "score_file": "score.musicxml"
}
