{
  "title": "Ode to Joy (theme)",
  "composer": "Ludwig van Beethoven",
  "composer_death_year": 1827,
  "composer_wikidata": "Q255",
  "traditional": false,
  "transcriber": "OpenTiles contributors",
  "arranger": "OpenTiles contributors",
  "source_url": "https://github.com/KunalGehlot/OpenTiles/tree/main/catalogue/pieces/ode-to-joy",
  "source_licence": "CC0-1.0",
  "edition_note": "Original simplified arrangement written for OpenTiles from the public-domain melody; not copied from any published edition. Source: arrangement.txt, rendered with tools/pipeline/arrange.py.",
  "eu_term_check": {
    "result": "pass",
    "date": "2026-10-07"
  },
  "difficulty": 1,
  "reviewed_by": null,
  "verified": false,
  "score_file": "score.musicxml"
}
